{
  "$schema": "http://json-schema.org/draft-07/schema#",
  "$id": "https://nucleos.invalid/contratos-propostos/subscription-event/1.0",
  "title": "SubscriptionEvent (PROPOSTO - ADR-026)",
  "description": "Evento normalizado de assinatura emitido pelo adaptador do provedor (ou pelo simulador) ao Control Plane. PROPOSTO: nao e o pacote packages/contracts (FND-003). Nao carrega dados de cartao nem PII; o payload bruto fica fora, referenciado por raw_payload_ref.",
  "type": "object",
  "additionalProperties": false,
  "required": ["schema_version", "provider", "provider_event_id", "event_type", "occurred_at", "received_at", "subscription", "simulated"],
  "properties": {
    "schema_version": { "const": "1.0" },
    "provider": { "type": "string", "enum": ["simulator", "stripe", "asaas", "mercadopago"] },
    "provider_event_id": { "type": "string", "minLength": 1, "maxLength": 128, "pattern": "^[A-Za-z0-9_.:-]+$", "description": "Chave de idempotencia junto com provider. Unique (provider, provider_event_id)." },
    "event_type": {
      "type": "string",
      "enum": [
        "subscription.created", "subscription.activated", "subscription.past_due",
        "subscription.suspended_by_provider", "subscription.resumed", "subscription.plan_changed",
        "subscription.canceled", "payment.succeeded", "payment.failed",
        "payment.action_required", "payment.refunded", "payment.disputed"
      ]
    },
    "occurred_at": { "type": "string", "format": "date-time", "description": "Informativo. NAO define ordem de aplicacao (ordem de entrega nao e garantida)." },
    "received_at": { "type": "string", "format": "date-time" },
    "simulated": { "type": "boolean" },
    "subscription": {
      "type": "object",
      "additionalProperties": false,
      "required": ["provider_subscription_id"],
      "properties": {
        "provider_subscription_id": { "type": "string", "minLength": 1, "maxLength": 128 },
        "provider_customer_id": { "type": "string", "minLength": 1, "maxLength": 128 },
        "tenant_id": { "type": "string", "format": "uuid", "description": "Presente quando o vinculo ja existe no Control Plane; senao o CP resolve por provider_subscription_id." },
        "plan_code": { "type": "string", "pattern": "^[a-z0-9][a-z0-9_-]{0,63}$" },
        "provider_status": { "type": "string", "maxLength": 64, "description": "Status bruto informado pelo provedor, so para auditoria." },
        "current_period_end": { "type": "string", "format": "date-time" }
      }
    },
    "payment": {
      "type": "object",
      "additionalProperties": false,
      "required": ["amount_minor", "currency"],
      "properties": {
        "provider_invoice_id": { "type": "string", "minLength": 1, "maxLength": 128 },
        "amount_minor": { "type": "integer", "minimum": 0 },
        "currency": { "type": "string", "pattern": "^[A-Z]{3}$" },
        "failure_code": { "type": "string", "maxLength": 64 },
        "attempt_count": { "type": "integer", "minimum": 1 },
        "next_retry_at": { "type": "string", "format": "date-time" }
      }
    },
    "raw_payload_ref": { "type": "string", "maxLength": 256, "description": "Referencia (chave/URI interna) ao payload bruto guardado fora do evento." }
  },
  "allOf": [
    {
      "if": { "properties": { "event_type": { "enum": ["payment.succeeded", "payment.failed", "payment.action_required", "payment.refunded", "payment.disputed"] } }, "required": ["event_type"] },
      "then": { "required": ["payment"] }
    },
    {
      "if": { "properties": { "event_type": { "const": "payment.failed" } }, "required": ["event_type"] },
      "then": { "properties": { "payment": { "required": ["failure_code", "attempt_count"] } } }
    },
    {
      "if": { "properties": { "event_type": { "const": "subscription.plan_changed" } }, "required": ["event_type"] },
      "then": { "properties": { "subscription": { "required": ["provider_subscription_id", "plan_code"] } } }
    },
    {
      "if": { "properties": { "provider": { "const": "simulator" } }, "required": ["provider"] },
      "then": { "properties": { "simulated": { "const": true } } },
      "else": { "properties": { "simulated": { "const": false } } }
    }
  ]
}
