{"schema_version":"1.0","received_at":"2026-10-25T12:00:05Z","occurred_at":"2026-10-25T12:00:00Z","provider":"stripe","simulated":false,"provider_event_id":"evt_example_0002","event_type":"payment.succeeded","subscription":{"provider_subscription_id":"sub_example_1","provider_customer_id":"cus_example_1","current_period_end":"2026-11-25T12:00:00Z"},"payment":{"provider_invoice_id":"in_example_1","amount_minor":9900,"currency":"BRL"},"raw_payload_ref":"webhook-raw/stripe/evt_example_0002"}
