{"schema_version":"1.0","received_at":"2026-10-25T12:00:05Z","occurred_at":"2026-10-25T12:00:00Z","provider":"simulator","simulated":true,"provider_event_id":"sim_evt_0004","event_type":"subscription.suspended_by_provider","subscription":{"provider_subscription_id":"sim_sub_001","tenant_id":"3f0c1a52-8d1e-4b7a-9c2e-5d6f7a8b9c0d"}}
